<xs:schema xmlns:xs="http://www.w3.org/2001/XMLSchema">

    <xs:element name="estudiantes">
        <xs:complexType>
            <xs:sequence>
                <xs:element name="estudiante" maxOccurs="unbounded">
                    <xs:complexType>
                        <xs:sequence>
                            <xs:element name="nombre" type="xs:string"/>
                            <xs:element name="fechaNacimiento" type="xs:date"/>
                            <xs:element name="grado" type="xs:string"/>
                            <xs:element name="cursos">
                                <xs:complexType>
                                    <xs:sequence>
                                        <xs:element name="curso" maxOccurs="unbounded">
                                            <xs:complexType>
                                                <xs:sequence>
                                                    <xs:element name="nombre" type="xs:string"/>
                                                    <xs:element name="profesor" type="xs:string"/>
                                                    <xs:element name="calificacion">
                                                        <xs:simpleType>
                                                            <xs:restriction base="xs:decimal">
                                                                <xs:minInclusive value="0.0"/>
                                                                <xs:maxInclusive value="10.0"/>
                                                            </xs:restriction>
                                                        </xs:simpleType>
                                                    </xs:element>
                                                </xs:sequence>
                                            </xs:complexType>
                                        </xs:element>
                                    </xs:sequence>
                                </xs:complexType>
                            </xs:element>
                        </xs:sequence>
                    </xs:complexType>
                </xs:element>
            </xs:sequence>
        </xs:complexType>
    </xs:element>

</xs:schema>